"","baseMean","log2FoldChange","lfcSE","stat","pvalue","padj"
"Firmicutes Clostridia Clostridiales Christensenellaceae",185.919223969773,7.00189190800756,1.40190406373457,4.99455853587802,5.89705039217301e-07,1.29891658508687e-05
"Bacteroidetes Bacteroidia Bacteroidales Odoribacteraceae",525.937671595771,-2.08653854008976,0.425271765127986,-4.90636508506933,9.27797560776333e-07,1.29891658508687e-05
"Firmicutes Erysipelotrichia Erysipelotrichales Erysipelatoclostridiaceae",134.265421507055,3.28721113921491,0.875503886428155,3.75465053916087,0.000173583493127648,0.00162011260252472
"Verrucomicrobia Verrucomicrobiae Verrucomicrobiales Akkermansiaceae",25674.697771771,-2.22253488915637,0.701334287404983,-3.16900931420307,0.0015295949323548,0.00922237730761527
"Bacteroidetes Bacteroidia Bacteroidales Prevotellaceae",4293.04843423332,2.48699115076078,0.790153540489234,3.14747833594585,0.00164685309064558,0.00922237730761527
"Firmicutes Clostridia Clostridiales Ruminococcaceae",2713.79419617627,1.12701396791448,0.526290008643056,2.14143143401161,0.0322392622906997,0.131791994987029
"Firmicutes Erysipelotrichia Erysipelotrichales Erysipelotrichaceae",2947.87263423955,-1.14438336340746,0.553308982754448,-2.06825372274016,0.0386161708993367,0.131791994987029
"Firmicutes Clostridia Clostridiales Lachnospiraceae",12436.111173163,0.926861633891481,0.453496542836319,2.04381190668969,0.0409721324506958,0.131791994987029
"Firmicutes Clostridia Clostridiales Eubacteriaceae",32.6633447773578,2.26270807581926,1.11466246497514,2.02994910739164,0.0423617126744021,0.131791994987029
"Firmicutes Clostridia Clostridiales unknown",118.298116333634,1.20043942736618,0.62291471662793,1.92713287280256,0.0539630729445123,0.151096604244634
"Proteobacteria Deltaproteobacteria Desulfovibrionales Desulfovibrionaceae",3475.49612764689,0.834310581399725,0.465531048659005,1.79216957451713,0.0731058067745616,0.186087508153429
"Bacteroidetes Bacteroidia Bacteroidales Bacteroidaceae",110643.902489575,-0.413812617351576,0.247868940891095,-1.66948152464729,0.0950219888607848,0.221717974008498
"Proteobacteria Betaproteobacteria Burkholderiales Sutterellaceae",8459.94193993957,0.838489645149434,0.514858167869018,1.62858374884081,0.1034011668427,0.222710205507355
"Proteobacteria Betaproteobacteria Burkholderiales Oxalobacteraceae",31.7020525569163,2.19221709554198,1.60025939640501,1.36991359055089,0.170713876761561,0.341427753523122
"Firmicutes Clostridia Clostridiales Catabacteriaceae",3.82773880672163,-1.92445306621222,1.47934522028703,-1.30088166022453,0.193298964573271,0.360824733870105
"Bacteroidetes Bacteroidia Bacteroidales Rikenellaceae",1779.32306229444,-0.798700410056878,0.715825717391614,-1.1157749584176,0.264518475358603,0.462907331877555
"unknown unknown unknown unknown",8.95458595351414,-1.51330922920453,1.57150200087851,-0.96296996654064,0.33556259544867,0.552691333680162
"Proteobacteria Gammaproteobacteria Enterobacterales Enterobacteriaceae",11939.6457674351,-0.916517737554688,1.0321038775706,-0.888009198950028,0.374535803121239,0.582611249299705
"Bacteroidetes Bacteroidia Bacteroidales Porphyromonadaceae",18599.4909575407,0.238704691716766,0.307647307129112,0.775903725419536,0.437805832802171,0.638111265026945
"Firmicutes Clostridia Clostridiales Peptostreptococcaceae",18.3548975421296,-1.92366937500287,2.57936838914178,-0.745790862251715,0.455793760733532,0.638111265026945
"Proteobacteria unknown unknown unknown",460.760515472481,-0.934051977706522,1.63955924923094,-0.56969699518005,0.568883228440775,0.75589671000077
"Bacteroidetes Bacteroidia Bacteroidales Barnesiellaceae",1010.42481693277,0.30083522368106,0.566774461423221,0.530784719773076,0.59556796993925,0.75589671000077
"Firmicutes Clostridia unknown unknown",19.5684075634755,-0.737921783778734,1.59241163678386,-0.463398889290391,0.643078474654034,0.75589671000077
"Firmicutes Clostridia Clostridiales Clostridiales_Incertae_Sedis_XIII",40.2084042144027,-0.450584708263577,0.986684284751271,-0.456665536511675,0.647911465714946,0.75589671000077
"Firmicutes Negativicutes Acidaminococcales Acidaminococcaceae",6164.41708210512,-0.124736670151459,0.361143092702604,-0.34539403541681,0.729798160647319,0.817373939924998
"Firmicutes unknown unknown unknown",144.624729622288,0.11473823374397,1.77527998229255,0.0646310637693327,0.94846775109701,1
"Actinobacteria Coriobacteriia Coriobacteriales Coriobacteriaceae",4.2978873164487,0,2.393702142591,0,1,1
"Firmicutes Bacilli Lactobacillales Streptococcaceae",39.3132966118616,0,2.40993863854732,0,1,1
